Name,symbol
"Riley Exploration Permian, Inc.",REPX
"RPC, Inc.",RES
WisdomTree International ESG Fund,RESD
WisdomTree Emerging Markets ESG Fund,RESE
Resonant Inc.,RESN
WisdomTree U.S. ESG Fund,RESP
"Reata Pharmaceuticals, Inc. Class A Common Stock",RETA
Direxion Daily Retail Bull 3X Shares,RETL
"ReTo Eco-Solutions, Inc. Common Shares",RETO
"Revlon, Inc.",REV
"REV Group, Inc.",REVG
Revolution Healthcare Acquisition Corp. SAIL Class A Common Stock,REVH
Revolution Healthcare Acquisition Corp. SAIL Units,REVHU
Columbia Research Enhanced Value ETF,REVS
REX American Resources Corp.,REX
"REXFORD INDUSTRIAL REALTY, INC.",REXR
"Rexford Industrial Realty, Inc 5.875% Series A Cumulative Redeemable Preferred Stock",REXRpA
"Rexford Industrial Realty, Inc. 5.875% Series B Cumulative Redeemable Preferred Stock",REXRpB
"Rexford Industrial Realty, Inc. 5.625% Series C Cumulative Redeemable Preferred Stock, par value $0.",REXRpC
Reynolds Consumer Products Inc. Common Stock,REYN
iShares Residential and Multisector Real Estate ETF,REZ
"Resideo Technologies, Inc. Common Stock",REZI
Regions Financial Corp.,RF
First Trust RiverFront Dynamic Asia Pacific ETF,RFAP
RiverFront Dynamic Core Income,RFCI
RiverFront Dynamic US Dividend Advantage ETF,RFDA
First Trust RiverFront Dynamic Developed International ETF,RFDI
First Trust RiverFront Dynamic Emerging Markets ETF,RFEM
First Trust RiverFront Dynamic Europe ETF,RFEU
RiverFront Dynamic US Flex-Cap ETF,RFFC
Invesco S&P MidCap 400 Pure Growth ETF,RFG
Cohen and Steers Total Return Realty Fund,RFI
RF Industries Ltd,RFIL
"Rafael Holdings, Inc. Class B Common Stock",RFL
"RiverNorth Flexible Municipal Income Fund, Inc.",RFM
"RiverNorth Flexible Municipal Income Fund II, Inc.",RFMZ
Resolute Forest Products Inc.,RFP
RiverFront Dynamic Unconstrained Income,RFUN
Invesco S&P MidCap 400 Pure Value ETF,RFV
REGIONS FINANCIAL CORPORATION Depositary Shares Each Representing a 1/40th Interest in a Share of 6.,RFpA
REGIONS FINANCIAL CORPORATION,RFpB
"Regions Financial Corporation Depositary Shares, each Representing a 1/40th Interest in a Share of 5",RFpC
"Regions Financial Corporation Depositary Shares, Each Representing a 1/40th Interest in a Share of 4",RFpE
"Reinsurance Group of America, Incorporated",RGA
RGC Resources Inc,RGCO
Repligen Corp,RGEN
Invesco S&P 500 Equal Weight Industrials ETF,RGI
Royal Gold Inc,RGLD
Regulus Therapeutics Inc.,RGLS
REGENXBIO Inc.,RGNX
Resources Connection,RGP
"Sturm, Ruger & Company, Inc.",RGR
Regis Corporation,RGS
"Royce Global Value Trust, Inc.",RGT
RH,RH
"Regional Health Properties, Inc.",RHE
"Regional Health Properties, Inc. Regional Health Properties, Inc. 10.875 percent Series A Cumulative",RHEpA
Robert Half International Inc.,RHI
"Ryman Hospitality Properties, Inc",RHP
Invesco S&P 500 Equal Weight Consumer Staples ETF,RHS
RiceBran Technologies,RIBT
Rice Acquisition Corp.,RICE
"Rice Acquisition Corp. Units, each consisting of one share of our Class A common stock and one-half",RICE.U
"RCI Hospitality Holdings, Inc.",RICK
Lordstown Motors Corp. Class A Common Stock,RIDE
Transocean LTD.,RIG
Rigel Pharmaceuticals Inc. (New),RIGL
RiverFront Strategic Income Fund,RIGS
"B. RILEY FINANCIAL, INC.",RILY
"B. Riley Financial, Inc. 7.25% Senior Notes due 2027",RILYG
"B. Riley Financial, Inc. 7.375% Senior Notes due 2023",RILYH
"B. Riley Financial, Inc. 6.875% Senior Notes due 2023",RILYI
"B. Riley Financial, Inc. 5.50% Senior Notes Due 2026",RILYK
"B. Riley Financial, Inc. Depositary Shares each representing 1/1000th in a share of 7.375% Series B",RILYL
"B. Riley Financial, Inc. 6.375% Senior Notes due 2025",RILYM
"B. Riley Financial, Inc. 6.50% Senior Notes Due 2026",RILYN
"B. Riley Financial, Inc. 6.75% Senior Notes due 2024",RILYO
"B. Riley Financial, Inc. Depositary Shares, each representing a 1/1000th fractional interest in a sh",RILYP
"B. Riley Financial, Inc. 6.00% Senior Notes Due 2028",RILYT
ProShares Inflation Expectations ETF,RINF
iShares MSCI Global Gold Miners ETF,RING
Rio Tinto plc,RIO
"Riot Blockchain, Inc. Common Stock",RIOT
Inspire Tactical Balanced ESG ETF,RISN
"RiverNorth Opportunities Fund, Inc. Common Stock",RIV
Riverview Financial Corporation Common Stock,RIVE
AB Svensk Ekportkredit ELEMENTS Linked to the Rogers International Commodity Index-Agriculture Total,RJA
"Raymond James Financial, Inc.",RJF
AB Svensk Ekportkredit ELEMENTS Linked to the Rogers International Commodity Index-Total Return,RJI
AB Svensk Ekportkredit ELEMENTS Linked to the Rogers International Commodity Index-Energy Total Retu,RJN
AB Svensk Ekportkredit ELEMENTS Linked to the Rogers International Commodity Index-Metals Total Retu,RJZ
"Arcadia Biosciences, Inc.",RKDA
"Rocket Companies, Inc.",RKT
Rocket Internet Growth Opportunities Corp.,RKTA
"Rocket Internet Growth Opportunities Corp. Units, each consisting of one Class A ordinary share and",RKTA.U
Ralph Lauren Corporation,RL
"Relay Therapeutics, Inc. Common Stock",RLAY
"Radiant Logistics, Inc.",RLGT
REALOGY HOLDINGS CORP.,RLGY
RLI Corp.,RLI
RLJ Lodging Trust,RLJ
RLJ Lodging Trust $1.95 Series A Cumulative Convertible Preferred Shares,RLJpA
"Relmada Therapeutics, Inc. Common Stock",RLMD
"RLX Technology Inc. American Depositary Shares, each representing the right to receive one (1) Class",RLX
SPDR SSgA Multi-Asset Real Return ETF of SSgA Active Trust,RLY
REGIONAL MANAGEMENT CORP,RM
"RE/MAX HOLDINGS, INC.",RMAX
"Richmond Mutual Bancorporation, Inc. Common Stock",RMBI
"RumbleOn, Inc. Class B Common Stock",RMBL
Rambus Inc,RMBS
"Rocky Mountain Chocolate Factory, Inc. Common Stock",RMCF
ResMed Inc.,RMD
"Ra Medical Systems, Inc",RMED
RMG Acquisition Corp. II Class A Ordinary Shares,RMGB
RMG Acquisition Corp. II Unit,RMGBU
RMG Acquisition Corp. III Class A Ordinary Shares,RMGC
RMG Acquisition Corp. III Unit,RMGCU
"RiverNorth Opportunistic Municipal Income Fund, Inc. Common Stock",RMI
"RiverNorth Managed Duration Municipal Income Fund, Inc.",RMM
"Rimini Street, Inc. (DE) Common Stock",RMNI
"Romeo Power, Inc.",RMO
RiverNorth Specialty Finance Corporation 5.875%% Series A Term Preferred Stock $0.0001 par value per,RMPLp
The RMR Group Inc. Class A Common Stock,RMR
RMR Mortgage Trust Common Stock,RMRM
Royce Micro-Cap Trust Inc,RMT
"Rockwell Medical, Inc. (DE) Common Stock",RMTI
"Avidity Biosciences, Inc. Common Stock",RNA
"Randolph Bancorp, Inc. Common Stock",RNDB
First Trust Developed International Equity Select ETF,RNDM
First Trust US Equity Dividend Select ETF,RNDV
First Trust Emerging Markets Equity Select ETF,RNEM
"RINGCENTRAL, INC.",RNG
"Ranger Energy Services, Inc.",RNGR
First Trust Large Cap US Equity Select ETF,RNLC
Renalytix AI plc American Depositary Shares,RNLX
First Trust Mid Cap US Equity Select ETF,RNMC
"Cohen & Steers REIT and Preferred and Income Fund, Inc.",RNP
RenaissanceRe Holdings Ltd.,RNR
Global X Funds Global X Renewable Energy Producers ETF,RNRG
RENAISSANCERE HOLDINGS LTD 5.375% SER E,RNRpE
"RenaissanceRe Holdings Ltd. Depositary Shares, each Representing a 1/1,000th Interest in a 5.750% Se",RNRpF
First Trust Small Cap US Equity Select ETF,RNSC
Renasant Corporation,RNST
RealNetworks Inc,RNWK
"Construction Partners, Inc. Class A Common Stock",ROAD
Hartford Multifactor Emerging Markets ETF,ROAM
ROBO Global Robotics & Automation Index ETF,ROBO
First Trust Nasdaq Artificial Intelligence and Robotics ETF,ROBT
Roth CH Acquisition II Co. Common Stock,ROCC
Roth CH Acquisition II Co. Unit,ROCCU
"Gibraltar Industries, Inc.",ROCK
Roth CH Acquisition III Co. Common stock,ROCR
Roth CH Acquisition III Co. Unit,ROCRU
Hartford Multifactor Diversified International ETF,RODE
iPath Return on Disability ETN,RODI
Hartford Multifactor Developed Markets (ex-US) ETF,RODM
Rogers Corporation,ROG
Retail Opportunity Investments Corp.,ROIC
"Rockwell Automation, Inc.",ROK
SPDR S&P Kensho Final Frontiers ETF,ROKT
"Roku, Inc. Class A Common Stock",ROKU
"Rollins, Inc.",ROL
RBC Bearings Incorporated,ROLL
ProShares Ultra Technology,ROM
Strategy Shares Newfound/ReSolve Robust Momentum ETF,ROMO
IQ US REAL ESTATE SMALL CAP ETF,ROOF
"Root, Inc. Class A Common Stock",ROOT
"Roper Technologies, Inc",ROP
ATAC US Rotation ETF,RORO
Hartford Multifactor Small Cap ETF,ROSC
Ross Acquisition Corp II,ROSS
"Ross Acquisition Corp II Units, each consisting of one Class A ordinary share and one-third of one r",ROSS.U
Ross Stores Inc,ROST
Rotor Acquisition Corp.,ROT
"Rotor Acquisition Corp. Units, each consisting of one share of Class A Common Stock and one-half of",ROT.U
Hartford Multifactor US Equity ETF,ROUS
"RETAIL PROPERTIES OF AMERICA, INC.",RPAI
RPAR Risk Parity ETF,RPAR
Repay Holdings Corporation Class A Common Stock,RPAY
"Rapid7, Inc. Common Stock",RPD
Invesco S&P 500 Pure Growth ETF,RPG
"Reneo Pharmaceuticals, Inc. Common Stock",RPHM
"RPM International, Inc.",RPM
Royalty Pharma plc Class A Ordinary Shares,RPRX
RPT Realty Common Shares of Beneficial Interest (MD),RPT
Repare Therapeutics Inc. Common Shares,RPTX
RPT Realty 7.25% Series D Cumulative Convertible Perpetual Preferred Shares of Beneficial Interest,RPTpD
Invesco S&P 500 Pure Value ETF,RPV
"COHEN & STEERS QUALITY INCOME REALTY FUND, INC. COMMON SHARES",RQI
"Red River Bancshares, Inc. Common Stock",RRBI
Range Resources Corp,RRC
RR Donnelley & Sons Co.,RRD
Red Robin Gourmet Burgers Inc,RRGB
"Red Rock Resorts, Inc. Class A Common Stock",RRR
Reliance Steel & Aluminium Co.,RS
RiverNorth Specialty Finance Corporation,RSF
Republic Services Inc.,RSG
"Rush Street Interactive, Inc.",RSI
Invesco S&P 500 Equal Weight ETF,RSP
Rodgers Silicon Valley Acquisition Corp. Common Stock,RSVA
Rodgers Silicon Valley Acquisition Corp. Unit,RSVAU
VanEck Vectors Russia ETF,RSX
VanEck Vectors Russia Small-Cap ETF,RSXJ
Rareview Tax Advantaged Income ETF,RTAI
VanEck Vectors Retail ETF,RTH
Rattler Midstream LP Common Units,RTLR
Invesco S&P 500 Equal Weight Materials ETF,RTM
Reinvent Technology Partners,RTP
"Reinvent Technology Partners Units, each consisting of one Class A ordinary share and one-fourth of",RTP.U
Reinvent Technology Partners Y Class A Ordinary Shares,RTPY
Reinvent Technology Partners Y Unit,RTPYU
Reinvent Technology Partners Z,RTPZ
"Reinvent Technology Partners Z Units, each consisting of one Class A ordinary share and  one-fifth o",RTPZ.U
Raytheon Technologies Corporation,RTX
"Rubius Therapeutics, Inc",RUBY
Sunrun Inc,RUN
Rush Enterprises Inc,RUSHA
Rush Enterprises Inc,RUSHB
Direxion Daily Russia Bull 2X Shares,RUSL
"Ruth's Hospitality Group, Inc.",RUTH
Retail Value Inc. Common Shares,RVI
"Revolve Group, Inc.",RVLV
"Revolution Medicines, Inc. Common Stock",RVMD
"Revance Therapeutics, Inc.",RVNC
Xtrackers Municipal Infrastructure Revenue Bond ETF,RVNU
"Retractable Technologies, Inc",RVP
"Reviva Pharmaceuticals Holdings, Inc. Common Stock",RVPH
Riverview Bancorp Inc,RVSB
"Royce Value Trust, Inc.",RVT
Direxion Russell 1000 Growth Over Value ETF,RWGV
Invesco S&P SmallCap 600 Revenue ETF,RWJ
Invesco S&P MidCap 400 Revenue ETF,RWK
Invesco S&P 500 Revenue ETF,RWL
ReWalk Robotics Ltd,RWLK
ProShares Short Russell2000,RWM
SPDR  Dow Jones  Global Real Estate ETF,RWO
SPDR Dow Jones REIT ETF,RWR
"Redwood Trust, Inc.",RWT
Direxion Russell 1000 Value Over Growth ETF,RWVG
SPDR Dow Jones  International Real Estate ETF,RWX
ProShares UltraShort Health Care,RXD
"Prometheus Biosciences, Inc. Common Stock",RXDX
iShares Global Consumer Discretionary ETF,RXI
ProShares Ultra Health Care,RXL
REXNORD CORPORATION,RXN
RXR Acquisition Corp. Class A Common Stock,RXRA
RXR Acquisition Corp. Units,RXRAU
"Recursion Pharmaceuticals, Inc. Class A Common Stock",RXRX
"Rackspace Technology, Inc. Common Stock",RXT
Royal Bank of Canada,RY
Ryanair Holdings plc American Depositary Shares,RYAAY
Rayonier Advanced Materials Inc.,RYAM
"RYB Education, Inc. American depositary shares, each representing one Class A ordinary share",RYB
Invesco S&P 500 Equal Weight Energy ETF,RYE
Invesco S&P 500 Equal Weight Financials ETF,RYF
Invesco S&P 500 Equal Weight Health Care ETF,RYH
RYERSON HOLDING CORPORATION,RYI
Invesco Raymond James SB-1 Equity ETF,RYJ
Global X Russell 2000 Covered Call ETF,RYLD
Rayonier Inc.,RYN
Invesco S&P 500 Equal Weight Technology ETF,RYT
"Rhythm Pharmaceuticals, Inc. Common Stock",RYTM
Invesco S&P 500 Equal Weight Utilities ETF,RYU
"Royal Bank of Canada Depositary Shares, each representing a 1/40th interest in a share of 6.750% Fix",RYpT
"REINSURANCE GROUP OF AMERICA, INCORPORATED 6.20% Fixed-To-Floating Rate Subordinated Debentures due",RZA
"Reinsurance Group of America, Incorporated 5.75% Fixed-To-Floating Rate Subordinated Debentures due",RZB
Invesco S&P SmallCap 600 Pure Growth ETF,RZG
"Rezolute, Inc. Common Stock",RZLT
Invesco S&P SmallCap 600 Pure Value ETF,RZV
"Seabridge Gold, Inc.",SA
ProShares Ulta SmallCap600,SAA
Sabre Corporation,SABR
Sabre Corporation 6.50% Series A Mandatory Convertible Preferred Stock,SABRP
Sachem Capital Corp. 6.875% Notes due 2024,SACC
Sachem Capital Corp. Common Shares,SACH
Saratoga Investment Corp. 6.25% Notes due 2025,SAF
Safehold Inc.,SAFE
Sanderson Farms Inc,SAFM
Safety Insurance Group Inc,SAFT
"Sage Therapeutics, Inc",SAGE
"Sonic Automotive, Inc.",SAH
"Saia, Inc.",SAIA
SCIENCE APPLICATIONS INTERNATIONAL CORPORATION,SAIC
Software Acquisition Group Inc. II Class A Common Stock,SAII
Software Acquisition Group Inc. II Unit,SAIIU
"SailPoint Technologies Holdings, Inc. Common Stock",SAIL
Saratoga Investment Corp. 7.25% Notes due 2025,SAK
"Salisbury Bancorp, Inc.",SAL
"Salem Media Group, Inc. Class A Common Stock",SALM
Boston Beer Company,SAM
Silvercrest Asset Management Group Inc.,SAMG
Banco Santander S.A.,SAN
"Sana Biotechnology, Inc. Common Stock",SANA
Sandstorm Gold Ltd,SAND
Sanmina  Corp,SANM
SAP SE,SAP
SARATOGA INVESTMENT CORP. NEW,SAR
Sandy Spring Bancorp Inc,SASR
EchoStar Corporation,SATS
"Cassava Sciences, Inc.",SAVA
"Spirit Airlines, Inc.",SAVE
"Safe Bulkers, Inc.",SB
SBA Communications Corp,SBAC
ProShares Short SmallCap600,SBB
Scorpio Tankers Inc. 7.00% Senior Notes due 2025,SBBA
Strongbridge Biopharma plc.,SBBP
Seacoast Banking Corp of Florida,SBCF
SilverBox Engaged Merger Corp I Class A Common Stock,SBEA
SilverBox Engaged Merger Corp I Units,SBEAU
"SB Financial Group, Inc.",SBFG
Sandbridge Acquisition Corporation,SBG
"Sandbridge Acquisition Corporation Units, each consisting of one share of Class A Common Stock and o",SBG.U
Sinclair Broadcast Group Inc,SBGI
"Sally Beauty Holdings, Inc.",SBH
"Western Asset Intermediate Muni Fund, Inc.",SBI
Sandbridge X2 Corp.,SBII
"Sandbridge X2 Corp. Units, each consisting of one share of Class A common stock and one-third of one",SBII.U
ALPS Medical Breakthroughs ETF,SBIO
Star Bulk Carriers Corp.,SBLK
Star Bulk Carriers Corp. 8.30 Percent Senior Notes due 2022,SBLKZ
ProShares Short Basic Materials,SBM
Signature Bank,SBNY
"Signature Bank Depositary shares, each representing a 1/40th ownership interest in a share of 5.000%",SBNYP
"SilverBow Resources, Inc.",SBOW
Sabine Royalty Trust,SBR
"Sabra Healthcare REIT, Inc.",SBRA
COMPANHIA DE SANEAMENTO B SICO DO ESTADO DE SAO PAULO-SABESP ADS'S,SBS
Southside Bancshares Inc,SBSI
"Sterling Bancorp, Inc. Common Stock",SBT
"Silverback Therapeutics, Inc. Common Stock",SBTX
iPath Silver ETN,SBUG
Starbucks Corp,SBUX
"SAFE BULKERS, INC. 8.00%  SER C",SBpC
"Safe Bulkers, Inc. 8.00% Series D",SBpD
SANTANDER CONSUMER USA HOLDINGS INC,SC
Stratim Cloud Acquisition Corp. Class A Common Stock,SCAQ
Stratim Cloud Acquisition Corp. Unit,SCAQU
ProShares UltraShort Consumer Services,SCC
Sachem Capital Corp. 7.125% Notes due 2024,SCCB
Sachem Capital Corp. 7.75% Notes due 2025,SCCC
Southern Copper Corporation,SCCO
"LMP Capital and Income Fund, Inc.",SCD
ETRACS 2x Leveraged US Dividend Factor TR ETN,SCDL
SCE TRUST II 5.10% Trust Preference Securities,SCEpG
SCE TRUST III 5.75% Fixed-to-Floating Rate Trust Preference Securities of SCE Trust III,SCEpH
SCE TRUST IV 5.375% Fixed-to-Floating Rate Trust Preference Securities,SCEpJ
SCE TRUST V,SCEpK
SCE TRUST VI 5.00% Trust Preference Securities,SCEpL
Schwab U.S Small- Cap ETF,SCHA
Schwab U.S. Broad Market ETF,SCHB
Schwab International Small-Cap Equity ETF,SCHC
Schwab US Dividend Equity ETF,SCHD
Schwab Emerging Markets Equity ETF,SCHE
Schwab International Equity ETF,SCHF
Schwab U.S. Large-Cap Growth ETF,SCHG
Schwab U.S. REIT ETF,SCHH
Schwab 5-10 Year Corporate Bond ETF,SCHI
Schwab 1-5 Year Corporate Bond ETF,SCHJ
Schwab 1000 Index ETF,SCHK
Scholastic Corp,SCHL
Schwab U.S. Mid-Cap ETF,SCHM
Schnitzer Steel Industries Inc,SCHN
Schwab Short-Term U.S. Treasury ETF,SCHO
Schwab U.S. TIPS ETF,SCHP
Schwab Long-Term U.S. Treasury ETF,SCHQ
Schwab Intermediately-Term U.S. Treasury ETF,SCHR
Schwab U.S. Large-Cap Value ETF,SCHV
The Charles Schwab Corporation,SCHW
Charles Schwab Corporation Depositary Shares each representing 1/40th interest in a share of 5.95% N,SCHWpD
"The Charles Schwab Corporation Depositary Shares, Each Representing a 1/40th Interest in a Share of",SCHWpJ
Schwab U.S. Large- Cap ETF,SCHX
Schwab International Dividend Equity ETF,SCHY
Schwab US Aggregate Bond ETF,SCHZ
Service Corporation International,SCI
iShares MSCI Japan Small-Cap ETF,SCJ
"Socket Mobile, Inc. New",SCKT
Stepan Co.,SCL
Broadscale Acquisition Corp. Class A common stock,SCLE
Broadscale Acquisition Corp. Units,SCLEU
STELLUS CAPITAL INVESTMENT CORPORATION,SCM
ProShares UltraShort Bloomberg Crude Oil,SCO
ScION Tech Growth I Class A Ordinary Shares,SCOA
ScION Tech Growth I Unit,SCOAU
ScION Tech Growth II Class A Ordinary Shares,SCOB
ScION Tech Growth II Units,SCOBU
"comScore, Inc. Common Stock",SCOR
SC Health Corporation,SCPE
"SC Health Corporation Units, each consisting of one Class A ordinary share, $0.0001 par value, and o",SCPE.U
scPharmaceuticals Inc. Common Stock,SCPH
SciPlay Corporation Class A Common Stock,SCPL
Scopus BioPharma Inc. Common Stock,SCPS
Score Media and Gaming Inc. Class A Subordinate Voting Shares,SCR
"Steelcase, Inc.",SCS
Scansource Inc,SCSC
"Sculptor Capital Management, Inc. Class A Common Stock",SCU
Shoe Carnival Inc,SCVL
SCVX Corp.,SCVX
"SCVX Corp. Units, each consisting of one Class A ordinary share, $0.0001 par value per share, and on",SCVX.U
SecureWorks Corp  Class A Common Stock,SCWX
The L.S. Starrett Company,SCX
"SCYNEXIS, Inc.",SCYX
iShares MSCI EAFE Small-Cap ETF,SCZ
"SandRidge Energy, Inc.",SD
Sustainable Development Acquisition I Corp. Class A Common Stock,SDAC
Sustainable Development Acquisition I Corp. Unit,SDACU
"SmileDirectClub, Inc. Class A Common Stock",SDC
USCF SummerHaven Dynamic Commodity Strategy No K-1 Fund,SDCI
ProShares UltraShort SmallCap600,SDD
Sound Enhanced Fixed Income ETF,SDEF
Sound Equity Income ETF,SDEI
Global X MSCI SuperDividend Emerging Markets ETF,SDEM
iShares Trust iShares MSCI Global Impact ETF,SDG
Impact Shares Sustainable Development Goals Global Equity ETF,SDGA
"Schrodinger, Inc. Common Stock",SDGR
"Global Internet of People, Inc. Ordinary Shares",SDH
PGIM Short Duration High Yield Opportunities Fund,SDHY
Global X SuperDividend ETF,SDIV
ALPS Sector Dividend Dogs ETF,SDOG
ProShares UltraPro Short Dow 30,SDOW
ProShares UltraShort Utilities,SDP
Superior Drilling Products Inc.,SDPI
ProShares UltraShort S&P500,SDS
First Trust SMID Cap Rising Dividend Achievers ETF,SDVY
SPDR S&P Dividend ETF,SDY
"Sea Limited American Depositary Shares, each representing one Class A Ordinary Share",SE
Seachange International Inc,SEAC
Sports Entertainment Acquisition Corp.,SEAH
"Sports Entertainment Acquisition Corp. Units, each consisting of one share of Class A Common Stock,",SEAH.U
SEAWORLD ENTERTAINMENT INC,SEAS
Seaboard Corporation,SEB
Secoo Holding Limited ADR,SECO
Main Sector Rotation ETF,SECT
"SolarEdge Technologies, Inc.",SEDG
Sealed Air Corp.,SEE
Origin Agritech Limited,SEED
"Seelos Therapeutics, Inc. Common Stock",SEEL
"Seer, Inc. Class A Common Stock",SEER
ProShares Short Financials,SEF
SEI Investments Co,SEIC
Virtus SEIX Senior Loan ETF,SEIX
"Selecta Biosciences, Inc",SELB
"Global Self Storage, Inc. Common Stock",SELF
SELECT MEDICAL HOLDINGS CORP,SEM
"SEMrush Holdings, Inc.",SEMR
Seneca Foods Corp,SENEA
Seneca Foods Corp,SENEB
"Senseonics Holdings, Inc.",SENS
AdvisorShares Alpha DNA Equity Sentiment ETF,SENT
TrueShares Structured Outcome (September) ETF,SEPZ
"Sesen Bio, Inc. Common Stock",SESN
Stifel Financial Corp.,SF
Stifel Financial Corp.5.20 percent Senior Notes due 2047,SFB
"Sound Financial Bancorp, Inc.",SFBC
ServisFirst Bancshares Inc,SFBS
"Safeguard Scientifics, Inc.",SFE
Safe-T Group Ltd. American Depositary Share,SFET
WisdomTree U.S. Short Term High Yield Corporate Bond Fund,SFHY
WisdomTree U.S. Short Term Corporate Bond Fund,SFIG
"Stitch Fix, Inc. Class A Common Stock",SFIX
SFL Corporation Ltd.,SFL
"Sprouts Farmers Market, Inc.",SFM
Simmons First National Corp,SFNC
"Southern First Bancshares, Inc.",SFST
"Shift Technologies, Inc. Class A Common Stock",SFT
"Osprey Technology Acquisition Corp. Units, each consisting of one share of Class A Common Stock and",SFTW.U
Fang Holdings Limited American Depositary Shares (each representing ten Class A Ordinary Shares),SFUN
SoFi Select 500 ETF,SFY
SoFi Social 50 ETF,SFYF
SoFi Next 500 ETF,SFYX
Stifel Financial Corp.,SFpA
"Stifel Financial Corp. Depositary Shares, Each Representing 1/1,000th Interest in a Share of 6.25% N",SFpB
"Stifel Financial Corp. Depositary Shares, Each Representing 1/1, 000th Interest in a Share of 6.125%",SFpC
"Saga Communications, Inc. Class A Common Stock (FL)",SGA
Seaport Global Acquisition Corp. Class A Common Stock,SGAM
Seaport Global Acquisition Corp. Unit,SGAMU
"SG Blocks, Inc. Common Stock",SGBX
"Superior Group of Companies, Inc. Common Stock",SGC
Sprott Junior Gold Miners ETF,SGDJ
Sprott Gold Miners ETF,SGDM
Seagen Inc. Common Stock,SGEN
"Signify Health, Inc.",SGFY
iPath Series B Bloomberg Sugar Subindex Total ReturnSM ETN,SGG
"SMART Global Holdings, Inc. Ordinary Shares",SGH
"Sigma Labs, Inc. Common Stock",SGLB
Sigmatron International Inc,SGMA
"Sangamo Therapeutics, Inc. Common Stock",SGMO
Scientific Games Corp Common Stock,SGMS
"SGOCO Group, Ltd (Cayman Islands)",SGOC
Aberdeen Standard Physical Gold Shares ETF,SGOL
iShares 0-3 Month Treasury Bond ETF,SGOV
SPAR Group Inc,SGRP
"Surgery Partners, Inc. Common Stock",SGRY
"Sigilon Therapeutics, Inc. Common Stock",SGTX
"Star Group, L.P. Common Units Representing Limited Partner Interest",SGU
ProShares Short S&P500,SH
SCP & CO Healthcare Acquisition Company Class A Common Stock,SHAC
SCP & CO Healthcare Acquisition Company Unit,SHACU
WisdomTree Yield Enhanced U.S. Short-Term Aggregate Bond Fund,SHAG
Shake Shack Inc.,SHAK
Shore Bancshares Inc,SHBI
Sotera Health Company Common Stock,SHC
SPDR SSGA Gender Diversity Index ETF,SHE
Shenandoah Telecom Co,SHEN
Shinhan Financial Group Co Ltd,SHG
"Sinopec Shanghai Petrochemical Co., Ltd.",SHI
Seanergy Maritime Holdings Corp.,SHIP
Seanergy Maritime Holdings Corp Class B Warrant,SHIPZ
VictoryShares Protect America ETF,SHLD
"Shoals Technologies Group, Inc. Class A Common Stock",SHLS
"Shell Midstream Partners, L.P.",SHLX
SPDR Nuveen Bloomberg Barclays Short Term Municipal Bond ETF,SHM
"Sunstone Hotel Investors, Inc.",SHO
Steven Madden Ltd,SHOO
Shopify Inc. Class A subordinate voting shares,SHOP
"Sunstone Hotel Investors, Inc.",SHOpE
"Sunstone Hotel Investors, Inc.  6.450% Series F Cumulative Redeemable Preferred Stock",SHOpF
"Sunstone Hotel Investors, Inc. 6.125% Series H Cumulative Redeemable Preferred Stock",SHOpH
"SharpSpring, Inc.",SHSP
iShares Short Treasury Bond ETF,SHV
iShares 1-3 Year Treasury Bond ETF,SHY
VanEck Vectors Short High Yield Muni ETF,SHYD
"The Shyft Group, Inc. Common Stock",SHYF
iShares 0-5 Year High Yield Corporate Bond ETF,SHYG
Xtrackers Short Duration High Yield Bond ETF,SHYL
Silvergate Capital Corporation,SI
"SI-BONE, Inc. Common Stock",SIBN
"Select Interior Concepts, Inc. Class A Common Stock",SIC
Companhia Siderurgica Nacional S.A. (CSN),SID
Siebert Financial Corp,SIEB
"Sientra, Inc.",SIEN
"SIFCO Industries, Inc.",SIF
Sify Technologies Limited,SIFY
Signet Jewelers Limited,SIG
SIGA Technologies Inc.,SIGA
Selective Insurance Group,SIGI
"Selective Insurance Group, Inc. Depositary Shares, each representing a 1/1,000th interest in a share",SIGIP
Sprott Inc.,SII
ProShares UltraShort Industrials,SIJ
Global X Silver Miners ETF (NEW),SIL
Silicom Ltd,SILC
ETFMG Prime Junior Silver Miners ETF,SILJ
"Silk Road Medical, Inc. Common Stock",SILK
SilverCrest Metals Inc. Common Shares,SILV
"Groupo Simec, S.A.B de C.V.",SIM
Silicon Motion Technology Corporation,SIMO
SPDR S&P Kensho Intelligent Structures ETF,SIMS
"Sino-Global Shipping America, Ltd",SINO
"SiNtx Technologies, Inc. Common Stock",SINT
Sio Gene Therapies Inc. Common Stock,SIOX
"Sirius XM Holdings,  Inc",SIRI
SITE Centers Corp. Common Shares,SITC
"SITE Centers Corp. Depositary Shares, each representing a 1/20th interest in a share of 6.375% Class",SITCpA
"SiteOne Landscape Supply, Inc.",SITE
SiTime Corporation Common Stock,SITM
SVB Financial Group,SIVB
"SVB Financial Group Depositary Shs 5.25% Preferred Stock, Series A",SIVBP
Aberdeen Standard Physical Silver Shares ETF,SIVR
Six Flags Entertainment Corp.,SIX
6 Meridian Mega Cap Equity ETF,SIXA
6 Meridian Hedged Equity-Index Option Strategy ETF,SIXH
6 Meridian Low Beta Equity Strategy ETF,SIXL
6 Meridian Small Cap Equity ETF,SIXS
iShares MSCI USA Size Factor ETF,SIZE
Scienjoy Holding Corporation Ordinary Shares,SJ
ProShares Short High Yield,SJB
"South Jersey Industries, Inc.",SJI
"South Jersey Industries, Inc. 5.625% Junior Subordinated Notes due 2079",SJIJ
"South Jersey Industries, Inc. Corporate Units",SJIV
The J.M. Smucker Company,SJM
SPDR Bloomberg Barclays Short Term High Yield Bond ETF,SJNK
Shaw Communications Inc.,SJR
San Juan Basin Royalty Trust UBI,SJT
ProShares UltraShort Financials,SKF
The Beauty Health Company Class A Common Stock,SKIN
Skillz Inc.,SKLZ
"SK Telecom Co., Ltd.",SKM
FlexShares Credit-Scored US Corporate Bond Index Fund,SKOR
TANGER FACTORY OUTLET CENTERS,SKT
"Skechers U.S.A., Inc.",SKX
Skyline Champion Corporation Common Stock,SKY
Skydeck Acquisition Corp. Units,SKYAU
