Name,symbol
"Dragoneer Growth Opportunities Corp. Units, each consisting of one Class A ordinary share, and one-f",DGNR.U
Dragoneer Growth Opportunities Corp. II Class A Ordinary Shares,DGNS
Dragoneer Growth Opportunities Corp. III Class A Ordinary Shares,DGNU
"DB Gold Double Long ETN due February 15, 2038",DGP
WisdomTree Trust WisdomTree Emerging Markets Quality Dividend Growth Fund,DGRE
iShares Core Dividend Growth ETF,DGRO
WisdomTree Trust WisdomTree U.S. SmallCap Quality Dividend Growth Fund,DGRS
WisdomTree Trust WisdomTree U.S. Quality Dividend Growth Fund,DGRW
WisdomTree Emerging Markets SmallCap Dividend Fund,DGS
SPDR Global Dow ETF (based on The Global Dow),DGT
Quest Diagnostics Inc.,DGX
"DB Gold Short ETN due February 15, 2038",DGZ
DHB Capital Corp. Class A common stock,DHBC
DHB Capital Corp. Unit,DHBCU
Diversified Healthcare Trust Common Shares of Beneficial Interest,DHC
DHC Acquisition Corp. Class A ordinary share,DHCA
DHC Acquisition Corp. Unit,DHCAU
Diversified Healthcare Trust 5.625% Senior Notes due 2042,DHCNI
Diversified Healthcare Trust 6.25% Senior Notes Due 2046,DHCNL
BNY Mellon High Yield Strategies Fund,DHF
DiamondHead Holdings Corp. Class A Common Stock,DHHC
DiamondHead Holdings Corp. Unit,DHHCU
D.R. Horton Inc.,DHI
Diamond Hill Investment Group,DHIL
Danaher Corporation,DHR
"Danaher Corporation 4.75% Mandatory Convertible Preferred Stock, Series A",DHRpA
"Danaher Corporation 5.00% Mandatory Convertible Preferred Stock, Series B",DHRpB
WisdomTree U.S. High Dividend Fund,DHS
"DHT HOLDINGS, INC.",DHT
"DHI Group, Inc.",DHX
Credit Suisse High Yield Bond Fund,DHY
SPDR Dow Jones Industrial Average ETF Trust,DIA
Columbia Diversified Fixed Income Allocation ETF,DIAL
NUVEEN DOW 30SM DYNAMIC OVERWRITE FUND,DIAX
ProShares Ultra Oil & Gas,DIG
WisdomTree International MidCap Dividend Fund,DIM
"Dine Brands Global, Inc.",DIN
Davis Select International ETF,DINT
Diodes Inc,DIOD
The Walt Disney Company,DIS
Disruptive Acquisition Corporation I Class A Ordinary Shares,DISA
Disruptive Acquisition Corporation I Unit,DISAU
"Discovery, Inc. Series A Common Stock",DISCA
"Discovery, Inc. Series B Common Stock",DISCB
"Discovery, Inc. Series C Common Stock",DISCK
DISH Network Corp.,DISH
AMCON Distributing Co.,DIT
Global X SuperDividend U.S. ETF,DIV
AGFiQ Hedged Dividend Income Fund,DIVA
iShares U.S. Dividend and Buyback ETF,DIVB
Amplify CWP Enhanced Dividend Income ETF,DIVO
SmartETFs Dividend Builder ETF,DIVS
TrueShares Low Volatility Equity Income ETF,DIVZ
FT Cboe Vest U.S. Equity Deep Buffer ETF - January,DJAN
"ETRACS Bloomberg Commodity Index Total Return ETN Series B due October 31, 2039",DJCB
Daily Journal Corp,DJCO
Invesco Dow Jones Industrial Average Dividend ETF,DJD
"iPath Bloomberg Commodity Index Total Return ETN due June 12, 2036",DJP
FT Cboe Vest U.S. Equity Deep Buffer ETF - July,DJUL
FT Cboe Vest U.S. Equity Deep Buffer ETF - June,DJUN
"Delek US Holdings, Inc.",DK
Data Knights Acquisition Corp. Unit,DKDCU
"DELEK LOGISTICS PARTNERS, LP",DKL
DraftKings Inc. Class A Common Stock,DKNG
"Dick's Sporting Goods, Inc.",DKS
Delta Apparel Inc.,DLA
"Dolby Laboratories, Inc.Class A",DLB
Deep Lake Capital Acquisition Corp. Class A Ordinary Shares,DLCA
Deep Lake Capital Acquisition Corp. Unit,DLCAU
DLH Holdings Corp.,DLHC
WisdomTree U.S. LargeCap Dividend Fund,DLN
DYNAGAS LNG PARNERS LP,DLNG
"Dynagas LNG Partners LP 9.00% Series A Cumulative Redeemable Preferred Units, liquidation preference",DLNGpA
Dynagas LNG Partners LP 8.75% Series B Fixed to Floating Rate Cumulative Redeemable Perpetual Prefer,DLNGpB
"Dolphin Entertainment, Inc.",DLPN
"Digital Realty Trust, Inc.",DLR
"Digital Realty Trust, Inc. 5.250% Series J Cumulative Redeemable Preferred Stock",DLRpJ
"Digital Realty Trust, Inc. 5.850% Series K Cumulative Redeemable Preferred Stock, par value $0.01 pe",DLRpK
"Digital Realty Trust, Inc. 5.200% Series L Cumulative Redeemable Preferred Stock",DLRpL
WisdomTree International SmallCap Dividend Fund,DLS
Duluth Holdings Inc. Class B Common Stock,DLTH
Dollar Tree Inc.,DLTR
Deluxe Corporation,DLX
DoubleLine Yield Opportunities Fund,DLY
"Desktop Metal, Inc.",DM
DiaMedica Therapeutics Inc. Common Stock,DMAC
FT Cboe Vest U.S. Equity Deep Buffer ETF - March,DMAR
FT Cboe Vest U.S. Equity Deep Buffer ETF - May,DMAY
"BNY Mellon Municipal Bond Infrastructure Fund, Inc.",DMB
Democracy International Fund,DMCY
AAM S& P Developed Markets High Dividend Value ETF,DMDV
BNY Mellon Municipal Income Inc.,DMF
Dorchester Minerals LP,DMLP
Western Asset Mortgage Opportunity Fund Inc.,DMO
Digimarc Corporation,DMRC
DeltaShares S&P EM 100 & Managed Risk ETF,DMRE
DeltaShares S&P International Managed Risk ETF,DMRI
DeltaShares S&P 500 Managed Risk ETF,DMRL
DeltaShares S&P 400 Managed Risk ETF,DMRM
DeltaShares S&P 600 Managed Risk ETF,DMRS
"Digital Media Solutions, Inc.",DMS
"DermTech, Inc. Common Stock",DMTK
iShares ESG Advanced MSCI EAFE ETF,DMXF
"dMY Technology Group, Inc. III",DMYI
"dMY Technology Group, Inc. III Units, each consisting of one share of Class A common stock and one-f",DMYI.U
"dMY Technology Group, Inc. IV",DMYQ
"dMY Technology Group, Inc. IV Units, each consisting of one share of Class A common stock and one-fi",DMYQ.U
"Dun & Bradstreet Holdings, Inc.",DNB
WisdomTree Global ex-US Quality Dividend Growth Fund,DNL
Denali Therapeutics Inc. Common Stock,DNLI
"Danimer Scientific, Inc.",DNMR
Denison Mines Corp,DNN
FT Cboe Vest U.S. Equity Deep Buffer ETF - November,DNOV
NOW INC.,DNOW
DNP Select Income Fund Inc.,DNP
D and Z Media Acquisition Corp.,DNZ
"D and Z Media Acquisition Corp. Units, each consisting of one share of Class A Common Stock and one-",DNZ.U
PHYSICIANS REALTY TRUST,DOC
"DigitalOcean Holdings, Inc.",DOCN
FT Cboe Vest U.S. Equity Deep Buffer ETF - October,DOCT
"DocuSign, Inc. Common Stock",DOCU
ProShares Short Dow30,DOG
Dogness (International) Corporation Class A Common Stock,DOGZ
WisdomTree International LargeCap Dividend Fund,DOL
"Domo, Inc. Class B Common Stock",DOMO
WisdomTree U.S. MidCap Dividend Fund,DON
WisdomTree international Dividend Ex-Financials Fund,DOO
BRP Inc. Common Subordinate Voting Shares,DOOO
MASONITE INTERNATIONAL CORP,DOOR
"Dorman Products, Inc. New",DORM
Dover Corporation,DOV
Dow Inc.,DOW
Amdocs Limited,DOX
DouYu International Holdings Limited ADS,DOYU
Duff & Phelps Utility and Infrastructure Fund Inc.,DPG
Direxion Daily Regional Banks Bull 3X Shares,DPST
"Ault Global Holdings, Inc.",DPW
Domino's Pizza Inc.,DPZ
Daqo New Energy Corp. American Depositary Shares (each representing 5 Ordinary Shares),DQ
DRDGOLD Ltd.,DRD
Duke Realty Corp.,DRE
DiamondRock Hospitality Company,DRH
DiamondRock Hospitality Company 8.250% Series A Cumulative Redeemable Preferred Stock,DRHpA
"Darden Restaurants, Inc.",DRI
DarioHealth Corp. Common Stock,DRIO
Direxion Daily S&P Oil & Gas Exp. & Prod. Bear 2X Shares,DRIP
Global X Autonomous & Electric Vehicles ETF,DRIV
Direxion Daily Real Estate Bull 3X,DRN
"Dicerna Pharmaceuticals, Inc.",DRNA
"Dril-Quip, Inc.",DRQ
Durect Corp,DRRX
Aptus Defined Risk ETF,DRSK
DIRTT Environmental Solutions Ltd. Common Shares,DRTT
"Dominion Energy, Inc 2016 Series A 5.25% Enhanced Junior Subordinated Notes due 2076",DRUA
Direxion Daily Real Estate Bear 3X Shares,DRV
Driven Brands Holdings Inc. Common Stock,DRVN
WisdomTree Global ex-US Real Estate Fund,DRW
Drive Shack Inc.,DS
Duddell Street Acquisition Corp. Class A Ordinary Shares,DSAC
Duddell Street Acquisition Corp. Unit,DSACU
Duff & Phelps Select MLP and Midstream Energy Fund Inc.,DSE
FT Cboe Vest U.S. Equity Deep Buffer ETF - September,DSEP
"Diversey Holdings, Ltd. Ordinary Shares",DSEY
"Design Therapeutics, Inc. Common Stock",DSGN
Descartes Systems Group Inc,DSGX
iShares MSCI KLD 400 Social ETF,DSI
Innovator Double Stacker ETF - January,DSJA
"Daseke, Inc. Common Stock",DSKE
DOUBLELINE INCOME SOLUTIONS FUND,DSL
"BNY Mellon Strategic Municipal Bond Fund, Inc.",DSM
Innovator Double Stacker ETF - October,DSOC
Viant Technology Inc. Class A Common Stock,DSP
The De-SPAC ETF,DSPC
DSP Group Inc,DSPG
"Document Security Systems, Inc.",DSS
Diamond S Shipping Inc. Common Shares,DSSI
Distillate U.S. Fundamental Stability & Value ETF,DSTL
Distillate International Fundamental Stability & Value ETF,DSTX
"Blackrock Debt Strategies Fund, Inc.",DSU
Deswell Industries Inc,DSWL
"Diana Shipping, Inc.",DSX
"DIANA SHIPPING INC 8.875% Series B Cumulative Redeemable Perpetual Preferred Shares, $0.01 par value",DSXpB
Drive Shack Inc. Series B 9.75% Cumulative Redeemable Preferred Stock,DSpB
Drive Shack Inc. 8.05% Series C Cumulative Redeemable Preferred Stock,DSpC
Drive Shack Inc. 8.375% Series D Cumulative Redeemable Preferred Stock,DSpD
"Dynatrace, Inc.",DT
DTE Energy Company 2020 Series G 4.375% Junior Subordinated Debentures due 2080,DTB
WisdomTree U.S. Total Dividend Fund,DTD
DTE Energy Company,DTE
DAVIDsTEA Inc. Common Stock,DTEA
ALPS Disruptive Technologies ETF,DTEC
DTF Tax-Free Income Inc.,DTF
WisdomTree International High Dividend  Fund,DTH
"Precision BioSciences, Inc. Common Stock",DTIL
DTE Energy Company 2016 Series B 5.375% Junior Subordinated Debentures due 2076,DTJ
BROOKFIELD DTLA FUND OFFICE TRUST INVESTOR INC.,DTLAp
WisdomTree U.S. Dividend ex-Financials Fund,DTN
Digital Transformation Opportunities Corp. Class A Common Stock,DTOC
Digital Transformation Opportunities Corp. Units,DTOCU
DTE Energy Company 2019 Corporate Units,DTP
Datasea Inc. Common Stock,DTSS
Data Storage Corporation Common Stock,DTST
DTE Energy Company 2016 Series F 6.00% Junior Subordinated Debentures due 2076,DTY
Merlyn.AI SectorSurfer Momentum ETF,DUDE
ProShares UltraShort Oil & Gas,DUG
Duke Energy Corporation,DUK
Duke Energy Corporation 5.625% Junior Subordinated Debentures due 2078,DUKB
"Duke Energy Corporation 5.125% Junior Subordinated Debentures due January 15, 2073",DUKH
"Duke Energy Corporation Depositary Shares, each representing a 1/1,000th interest in a share of 5.75",DUKpA
Dune Acquisition Corporation Class A Common Stock,DUNE
Dune Acquisition Corporation Unit,DUNEU
Fangdd Network Group Ltd. American Depositary Shares,DUO
"Duos Technologies Group, Inc. Common Stock",DUOT
VanEck Vectors Morningstar Durable Dividend ETF,DURA
Davis Select U.S. Equity ETF,DUSA
Direxion Daily Industrials Bull 3X Shares,DUSL
Direxion Daily Gold Miners Index Bear 2X Shares,DUST
"DoubleVerify Holdings, Inc.",DV
DaVita Inc.,DVA
Dynavax Technologies Corporation,DVAX
Dover Motorsports,DVD
First Trust Dorsey Wright Momentum & Value ETF,DVLU
Devon Energy Corporation,DVN
First Trust Dorsey Wright Momentum & Low Volatility ETF,DVOL
iShares Select Dividend ETF,DVY
iShares Asia/Pacific Dividend ETF,DVYA
iShares Emerging Markets Dividend ETF,DVYE
Invesco DWA SmallCap Momentum ETF,DWAS
Arrow Investments Trust Arrow DWA Tactical ETF,DWAT
AdvisorShares Dorsey Wright FSM All Cap World ETF,DWAW
Arrow DWA Country Rotation ETF,DWCR
AdvisorShares Dorsey Wright Alpha Equal Weight ETF,DWEQ
Delwinds Insurance Acquisition Corp.,DWIN
"Delwinds Insurance Acquisition Corp. Units, each consisting of one share of Class A common stock, an",DWIN.U
Davis Select Worldwide ETF,DWLD
WisdomTree International Equity Fund,DWM
AdvisorShares Dorsey Wright Micro-Cap ETF,DWMC
WisdomTree International Multifactor Fund,DWMF
First Trust Dorsey Wright People's Portfolio ETF,DWPP
AdvisorShares Dorsey Wright Short ETF,DWSH
Dawson Geophysical Company New Common Stock,DWSN
AdvisorShares Dorsey Wright FSM US Core ETF,DWUS
SPDR S&P International Dividend ETF,DWX
"Dynex Capital, Inc.",DX
DXC Technology Company,DXC
"DexCom, Inc.",DXCM
ProShares UltraShort Dow 30,DXD
Dunxin Financial Holdings Limited,DXF
WisdomTree Germany Hedged Equity Fund,DXGE
WisdomTree Japan Hedged Equity Fund,DXJ
WisdomTree Japan Hedged SmallCap Equity Fund,DXJS
DXP Enterprises Inc,DXPE
Daxor Corporation,DXR
Dixie Group Inc,DXYN
"Dynex Capital, Inc. 6.900% Series C Fixed-to-Floating Rate Cumulative Redeemable Preferred Stock",DXpC
"Dycom Industries, Inc.",DY
"Dyadic International, Inc.",DYAI
Angel Oak Dynamic Financial Strategies Income Term Trust,DYFN
Direxion Dynamic Hedge ETF,DYHG
"Dyne Therapeutics, Inc. Common Stock",DYN
BlackRock U.S. Equity Factor Rotation ETF,DYNF
Dynamics Special Purpose Corp. Class A Common Stock,DYNS
Dynatronics Corp,DYNT
DZS Inc. Common Stock,DZSI
"DB Gold Double Short ETN due February 15, 2038",DZZ
ENI S.p.A.,E
Electronic Arts Inc,EA
Edify Acquisition Corp. Class A Common Stock,EAC
Edify Acquisition Corp. Units,EACPU
Edify Acquisition Corp. Warrant,EACPW
Wells Fargo Income Opportunities Fund,EAD
GrafTech International Ltd.,EAF
iShares ESG Aware U.S. Aggregate Bond ETF,EAGG
"Entergy Arkansas, LLC First Mortgage Bonds, 4.875% Series due September 1, 2066",EAI
iShares ESG Aware Aggressive Allocation ETF,EAOA
iShares ESG Aware Conservative Allocation ETF,EAOK
iShares ESG Aware Moderate Allocation ETF,EAOM
iShares ESG Aware Growth Allocation ETF,EAOR
Innovator MSCI Emerging Markets Power Buffer ETF-April,EAPR
"Eargo, Inc. Common Stock",EAR
ELLINGTON RESIDENTIAL MORTGAGE REIT,EARN
Auris Medical Holding Ltd. Common Shares 0.01 SF (Bermuda),EARS
Xtrackers MSCI EAFE ESG Leaders Equity ETF,EASG
"EASTSIDE DISTILLING , INC.",EAST
"Brinker International, Inc.",EAT
AdvisorShares Restaurant ETF,EATZ
"Eventbrite, Inc. Class A Common Stock",EB
European Biotech Acquisition Corp. Class A Ordinary Shares,EBAC
European Biotech Acquisition Corp. Units,EBACU
eBay Inc,EBAY
"Eastern Bankshares, Inc. Common Stock",EBC
"Esports Technologies, Inc. Common Stock",EBET
"Ennis, Inc.",EBF
Ebix Inc,EBIX
Global X E-commerce ETF,EBIZ
Ecofin Global Water ESG Fund,EBLU
"Eagle Bancorp Montana, Inc",EBMT
SPDR Bloomberg Barclays Emerging Markets Local Bond ETF,EBND
Ebang International Holdings Inc. Class A Ordinary Shares,EBON
Centrais El�tricas Brasileiras S.A.- Eletrobr�s American Depositary Shares (Each representing one Co,EBR
Centrais El�tricas Brasileiras S.A.- Eletrobr�s American Depositary Shares (Each representing one Pr,EBR.B
"Emergent Biosolutions, Inc.",EBS
"Meridian Bancorp, Inc.",EBSB
Enterprise Bancorp Inc.,EBTC
Ecopetrol S.A,EC
EAGLE POINT CREDIT COMPANY INC.,ECC
Eagle Point Credit Company Inc. 7.75% Series B Term Preferred Stock due 2026,ECCB
Eagle Point Credit Company Inc. 6.6875% Notes due 2028,ECCX
Eagle Point Credit Company Inc. 6.75% Notes due 2027,ECCY
Ellsworth Growth and Income Fund Ltd,ECF
Ellsworth Growth and Income Fund Ltd. 5.25 percent Series A Cumulative Preferred Shares (Liquidation,ECFpA
iShares MSCI Chile ETF,ECH
"Echo Global Logistics, Inc.",ECHO
"Ecolab, Inc.",ECL
First Trust EIP Carbon Impact ETF,ECLN
iShares MSCI China Small-Cap ETF,ECNS
"US Ecology, Inc.",ECOL
CHANNELADVISOR CORPORATION,ECOM
Columbia Emerging Markets Consumer ETF,ECON
"electroCore, Inc. Common Stock",ECOR
Pacer Emerging Markets Cash Cows 100 ETF,ECOW
TrueShares ESG Active Opportunities ETF,ECOZ
"Encore Capital Group, Inc.",ECPG
"Consolidated Edison, Inc.",ED
EDAP TMS SA,EDAP
"Direxion Daily Emerging Markets Bull 3X Shares, Shares of beneficial interest, no par value",EDC
"Morgan Stanley Emerging Markets Domestic Debt Fund, Inc.",EDD
iShares MSCI Denmark ETF,EDEN
STONE HARBOR EMERGING MARKETS INCOME FUND,EDF
STONE HARBOR EMERGING MARKETS TOTAL INCOME FUND,EDI
"Editas Medicine, Inc. Common Stock",EDIT
SPDR S&P Emerging Markets Dividend ETF,EDIV
Empresa Distribuidora Y Comercializadora Norte S.A. (Edenor),EDN
Global X Telemedicine & Digital Health ETF,EDOC
ALPS Emerging Sector Dividend Dogs ETF,EDOG
First Trust Dow 30 Equal Weight ETF,EDOW
"Endeavor Group Holdings, Inc.",EDR
EuroDry Ltd. Common Shares,EDRY
"Edesa Biotech, Inc. Common Shares",EDSA
Skillful Craftsman Education Technology Limited Ordinary Share,EDTK
EdtechX Holdings Acquisition Corp. II Class A common stock,EDTX
EdtechX Holdings Acquisition Corp. II Unit,EDTXU
"New Oriental Education and Technology Group, Inc.",EDU
Educational Development Corp,EDUC
Global X Education ETF,EDUT
Vanguard World Funds Extended Duration ETF,EDV
Direxion Daily Emerging Markets Bear 3x Shares,EDZ
"The European Equity Fund, Inc.",EEA
Euronet Worldwide Inc,EEFT
ELEMENTS Linked to the SPECTRUM Large Cap U.S.Sector Momentum Index,EEH
Elite Education Group International Ltd. Common Stock,EEIQ
Invesco S&P Emerging Markets Low Volatility ETF,EELV
iShares MSCI Emerging Markets ETF,EEM
iShares MSCI Emerging Markets Asia ETF,EEMA
AAM S&P Emerging Markets High Dividend Value ETF,EEMD
Invesco S&P Emerging Markets Momentum ETF,EEMO
iShares MSCI Emerging Markets Small-Cap ETF,EEMS
iShares MSCI Emerging Markets Min Vol Factor ETF,EEMV
SPDR MSCI Emerging Markets Fossil Fuel Reserves Free ETF,EEMX
WisdomTree U.S. SmallCap Fund,EES
ProShares Ultra MSCI Emerging Markets,EET
ProShares Trust UltraShort MSCI Emerging Markets,EEV
"Emerald Holding, Inc.",EEX
iShares MSCI EAFE ETF,EFA
ProShares MSCI EAFE Dividend Growers ETF,EFAD
Global X MSCI SuperDividend EAFE ETF,EFAS
iShares MSCI EAFE Min Vol Factor ETF,EFAV
SPDR MSCI EAFE Fossil Fuel Reserves Free ETF,EFAX
Ellington Financial Inc. Common Stock,EFC
Ellington Financial Inc. 6.750% Series A Fixed-to-Floating Rate Cumulative Redeemable Preferred Stoc,EFCpA
EATON VANCE FLOATING-RATE INCOME PLUS FUND,EFF
iShares MSCI EAFE Growth ETF,EFG
SPDR S&P 500 ESG ETF,EFIV
First Trust TCW Emerging Markets Debt ETF,EFIX
Eaton Vance Floating-Rate 2022 Target Term Trust Common Shares of Beneficial Interest,EFL
iShares MSCI Finland ETF,EFNL
ProShares Ultra MSCI EAFE,EFO
"Energy Focus, Inc.",EFOI
Eaton Vance Senior Floating-Rate Fund,EFR
Enterprise Financial Services Corporation,EFSC
Eaton Vance Floating-Rate Income Trust,EFT
ProShares Trust UltraShort MSCI EAFE,EFU
iShares MSCI EAFE Value ETF,EFV
"Equifax, Incorporated",EFX
ProShares Trust Short MSCI EAFE,EFZ
eGain Corporation,EGAN
Eagle Bancorp Inc,EGBN
"Blackrock Enhanced Government Fund, Inc.",EGF
"EG Acquisition Corp. Units, each consisting of one share of Class A common stock and one-third of on",EGGF.U
"8x8, Inc. Common Stock",EGHT
2ndVote Society Defended ETF,EGIS
Eagle Bulk Shipping Inc.,EGLE
Enthusiast Gaming Holdings Inc. Common Stock,EGLX
Eldorado Gold Corporation,EGO
EastGroup Properties Inc.,EGP
VanEck Vectors Egypt Index ETF,EGPT
"Eagle Pharmaceuticals, Inc.",EGRX
"Vaalco Energy, Inc.",EGY
EHang Holdings Limited ADS,EH
Encompass Health Corporation Common Stock,EHC
"Western Asset Global High Income Fund, Inc",EHI
Eaton Vance 2021 Target Term Trust,EHT
"eHealth, Inc.",EHTH
Eagle Point Income Company Inc.,EIC
iShares MSCI Indonesia ETF,EIDO
"Employers Holdings, Inc.",EIG
"Eiger BioPharmaceuticals, Inc.",EIGR
Eaton Vance Municipal Bond Fund,EIM
VanEck Vectors Energy Income ETF,EINC
iShares MSCI Ireland ETF,EIRL
iShares MSCI Israel ETF,EIS
Edison International,EIX
Innovator MSCI Emerging Markets Power Buffer ETF-January,EJAN
EJF Acquisition Corp. Class A Ordinary Share,EJFA
EJF Acquisition Corp. Unit,EJFAU
E-Home Household Service Holdings Limited Ordinary Shares,EJH
Innovator MSCI Emerging Markets Power Buffer ETF - July,EJUL
Capital Link NextGen Vehicles & Technology ETF,EKAR
"Ekso Bionics Holdings, Inc. Common Stock",EKSO
The Estee Lauder Companies Inc. Class A,EL
Envela Corporation,ELA
Elanco Animal Health Incorporated Common Stock,ELAN
Elanco Animal Health Incorporated 5.00% Tangible Equity Units,ELAT
"Entergy Louisiana, LLC Collateral Trust Mortgage Bonds, 4.875 % Series due September 1, 2066",ELC
WisdomTree Emerging Markets Local Debt Fund,ELD
"Eledon Pharmaceuticals, Inc. Common Stock",ELDN
"e.l.f. Beauty, Inc.",ELF
Ellomay Capital LTD,ELLO
"Electromed, Inc.",ELMD
"Eloxx Pharmaceuticals, Inc. Common Stock",ELOX
Companhia Paranaense de Energia  American Depositary Shares (each representing one Unit consisting o,ELP
"Equity Lifestyle Properties, Inc.",ELS
Electro-Sensors Inc,ELSE
Eltek Ltd,ELTK
"Elevate Credit, Inc.",ELVT
Callaway Golf Company,ELY
"Elys Game Technology, Corp. Common Stock",ELYS
Smart Share Global Limited American Depositary Shares,EM
VanEck Vectors Emerging Markets Aggregate Bond ETF,EMAG
eMagin Corporation,EMAN
iShares J.P. Morgan USD Emerging Markets Bond ETF,EMB
Global X Emerging Markets Bond ETF,EMBD
iShares Interest Rate Hedged Emerging Markets Bond ETF,EMBH
WisdomTree Emerging Markets Corporate Bond Fund,EMCB
Emclaire Financial Corp,EMCF
"Western Asset Emerging Markets Debt Fund, Inc",EMD
ProShares MSCI Emerging Markets Dividend Growers ETF,EMDV
"EMCOR Group, Inc.",EME
Templeton Emerging Markets Fund,EMF
Global X MSCI Next Emerging & Frontier ETF,EMFM
iShares MSCI Emerging Markets Multifactor ETF,EMGF
SPDR Bloomberg Barclays Emerging Markets USD Bond ETF,EMHC
iShares J.P. Morgan EM High Yield Bond ETF,EMHY
iShares Emerging Markets Infrastructure ETF,EMIF
Emcore Corp,EMKR
Eastern Company,EML
VanEck Vectors J.P. Morgan EM Local Currency Bond ETF,EMLC
First Trust North American Energy Infrastructure Fund,EMLP
WisdomTree Emerging Markets Multifactor Fund,EMMF
Eastman Chemical Company,EMN
PIMCO Enhanced Short Maturity Active ESG ETF,EMNT
ClearBridge Energy Midstream Opportunity Fund Inc.,EMO
"Entergy Mississippi, LLC First Mortgage Bonds, 4.90% Series due October 1, 2066",EMP
"Empower Ltd. Units, each consisting of one Class A ordinary share and one-third of one redeemable wa",EMPW.U
EMQQ The Emerging Markets Internet & Ecommerce ETF,EMQQ
Emerson Electric Co.,EMR
Xtrackers MSCI Emerging Markets ESG Leaders Equity ETF,EMSG
ProShares Short Term USD Emerging Markets Bond ETF,EMSH
SPDR DoubleLine Emerging Markets Fixed Income ETF,EMTL
ProShares Decline of the Retail Store ETF,EMTY
EMX Royalty Corporation,EMX
iShares MSCI Emerging Markets ex China ETF,EMXC
iShares ESG Advanced MSCI EM ETF,EMXF
"Enbridge, Inc",ENB
Enbridge Inc. 6.375% Fixed-to-Floating Rate Subordinated Notes Series 2018-B due 2078,ENBA
"ENABLE MIDSTREAM PARTNERS, LP",ENBL
Endo International plc,ENDP
"890 5th Avenue Partners, Inc. Class A Common Stock",ENFA
"890 5th Avenue Partners, Inc. Unit",ENFAU
Alerian Energy Infrastructure ETF,ENFR
ENGlobal Corp,ENG
Enel Am�ricas S.A. American Depositary Shares (Each representing 50 shares of Common Stock),ENIA
Enel Chile S.A. American Depositary Shares Representing Common Stock (Each representing 50 shares of,ENIC
"Entergy New Orleans, LLC First Mortgage Bonds, 5.0% Series due December 1, 2052",ENJ
"ENLINK MIDSTREAM, LLC",ENLC
Enlivex Therapeutics Ltd. Ordinary Shares,ENLV
ECP Environmental Growth Opportunities Corp. Class A Common Stock,ENNV
ECP Environmental Growth Opportunities Corp. Unit,ENNVU
"Entergy New Orleans, LLC First Mortgage Bonds, 5.50% Series due April 1, 2066",ENO
Enochian Biosciences Inc. Common Shares,ENOB
iShares MSCI Norway ETF,ENOR
Executive Network Partnering Corporation,ENPC
"Executive Network Partnering Corporation CAPS, each consisting of one share of Class A common stock,",ENPC.U
"Enphase Energy, Inc.",ENPH
"Energizer Holdings, Inc",ENR
"Energizer Holdings, Inc. 7.50% Series A Mandatory Convertible Preferred Stock",ENRpA
"EnerSys, Inc.",ENS
"The Ensign Group, Inc.",ENSG
Enservco Corp.,ENSV
"Enanta Pharmaceuticals, Inc",ENTA
Entegris Inc,ENTG
ERShares Entrepreneurs ETF,ENTR
Entera Bio Ltd. Ordinary Shares,ENTX
"ENVESTNET, INC.",ENV
"Enova International, Inc.",ENVA
"Enveric Biosciences, Inc. Common Stock",ENVB
Environmental Impact Acquisition Corp. Class A Common Stock,ENVI
Environmental Impact Acquisition Corp. Unit,ENVIU
Eaton Vance New York Municipal Bond Fund,ENX
"Enzo Biochem, Inc.",ENZ
iShares Trust iShares MSCI New Zealand ETF,ENZL
WELLS FARGO GLOBAL DIVIDEND OPPORTUNITY FUND,EOD
"EOG Resources, Inc.",EOG
Eaton Vance Enhanced Equity Income Fund,EOI
"Evolus, Inc. Common Stock",EOLS
Eaton Vance Enhance Equity Income Fund II,EOS
"Eos Energy Enterprises, Inc. Class A Common Stock",EOSE
EATON VANCE NATIONAL MUNICIPAL OPPORTUNITIES TRUST,EOT
Enerpac Tool Group Corp.,EPAC
"EPAM SYSTEMS, INC.",EPAM
Bottomline Technologies Inc,EPAY
Edgewell Personal Care Company,EPC
Enterprise Products Partners L.P.,EPD
iShares MSCI Philippines ETF,EPHE
Epiphany Technology Acquisition Corp. Class A Common Stock,EPHY
Epiphany Technology Acquisition Corp. Unit,EPHYU
WisdomTree India Earnings Fund ETF,EPI
ESSA Pharma Inc. Common Stock,EPIX
Evolution Petroleum Corporation,EPM
iShares MSCI Poland ETF,EPOL
iShares MSCI Pacific ex Japan ETF,EPP
EPR Properties,EPR
First Trust TCW ESG Premier Equity ETF,EPRE
Innovator S&P Investment Grade Preferred ETF,EPRF
"Essential Properties Realty Trust, Inc.",EPRT
EPR Properties 5.75% Series C Cumulative Convertible Preferred Shares,EPRpC
EPR Properties 9.00% Series E Cumulative Convertible Preferred Shares,EPRpE
EPR Properties 5.750% Series G Cumulative Redeemable Preferred Shares,EPRpG
WisdomTree U.S. LargeCap Fund,EPS
Epsilon Energy Ltd.,EPSN
iShares MSCI Peru ETF,EPU
ProShares UltraShort FTSE Europe,EPV
Empowerment & Inclusion Capital I Corp.,EPWR
"Empowerment & Inclusion Capital I Corp. Units, each consisting of one share of Class A common stock",EPWR.U
"Epizyme, Inc",EPZM
El Paso Energy Capital Trust I,EPpC
"Equillium, Inc. Common Stock",EQ
Invesco Russell 1000 Equal Weight ETF,EQAL
"Equity Bancshares, Inc. Class A Common Stock",EQBK
Equity Commonwealth,EQC
Equity Commonwealth 6 1/2% Series D Cumulative Convertible Preferred Shares,EQCpD
Equity Distribution Acquisition Corp.,EQD
"Equity Distribution Acquisition Corp. Units, each consisting of one share of Class A common stock, a",EQD.U
"Equitable Holdings, Inc.",EQH
EQ Health Acquisition Corp.,EQHA
"EQ Health Acquisition Corp. Units, each consisting of one share of Class A common stock and one-half",EQHA.U
"Equitable Holdings, Inc. Depositary Shares, each representing a 1/1000th interest in a share of Fixe",EQHpA
"Equitable Holdings, Inc. Depositary Shares, each representing a 1/1, 000th interest in a share of Fi",EQHpC
"Equinix, Inc. Common Stock REIT",EQIX
ALPS Equal Sector Weight ETF,EQL
"Equinor ASA American Depositary Shares (Each Representing One Ordinary Share, nominal value NOK 2.50",EQNR
Natixis U.S. Equity Opportunities ETF,EQOP
Diginex Limited Ordinary Shares,EQOS
Equity Residential,EQR
